{"decisionSha256":"f361d55574c57b18a915bf07fb702e6ec3024f8cb1d8b323871e48b0ab39def6","observationMeasurementSha256":"40406050626553b96756a88590f50ee68c32421e2c1c0abbfca124caf605925e","policyId":"candidate_v3_route_policy","policySha256":"171019b8fcf62449b3f5d6af37372f9861eb80bd21a7b621ae89c760199fdb33","policyVersion":"1.0","reasons":["POSITIVE_RULES_PASSED"],"routeCode":"ELIGIBLE","schemaVersion":"1.0"}