{"decisionSha256":"bd000234fd29f44ac80a7863ce24c84ce1b551bd493bb4754275a9270f8b0677","observationMeasurementSha256":"77f3c39cd83aad0d1a90c5453055723008920c2c2295ae1809c577e3d0a1cd97","policyId":"candidate_v3_route_policy","policySha256":"171019b8fcf62449b3f5d6af37372f9861eb80bd21a7b621ae89c760199fdb33","policyVersion":"1.0","reasons":["POSITIVE_RULES_PASSED"],"routeCode":"ELIGIBLE","schemaVersion":"1.0"}